{
  "$schema": "https://json-schema.org/draft/2020-12/schema",
  "$id": "https://cdn.jsdelivr.net/gh/ProductOfAmerica/usda-county-yields@main/data/_schema/price.json",
  "title": "NASS state price-received shard (v3)",
  "description": "One shard per (state, crop). State-level PRICE RECEIVED in $ / BU, as a marketing-year series and a monthly series per class. The ALL CLASSES marketing-year series is canonical. Monthly value keys are YYYY-MM; marketing-year keys are YYYY.",
  "type": "object",
  "additionalProperties": false,
  "required": ["schema_version", "state", "commodity", "series"],
  "properties": {
    "schema_version": {"const": 3},
    "state": {
      "type": "object",
      "additionalProperties": false,
      "required": ["fips", "alpha", "name"],
      "properties": {
        "fips": {"type": "string", "pattern": "^[0-9]{2}$"},
        "alpha": {"type": "string", "pattern": "^[A-Z]{2}$"},
        "name": {"type": "string"}
      }
    },
    "commodity": {
      "type": "object",
      "additionalProperties": false,
      "required": ["slug", "desc"],
      "properties": {"slug": {"type": "string"}, "desc": {"type": "string"}}
    },
    "series": {
      "type": "array",
      "items": {
        "type": "object",
        "additionalProperties": false,
        "required": ["class", "period", "unit", "values", "suppressed"],
        "properties": {
          "class": {"type": "string"},
          "period": {"type": "string", "enum": ["MARKETING YEAR", "MONTHLY"]},
          "unit": {"const": "$ / BU"},
          "canonical": {"type": "boolean"},
          "values": {"type": "object", "additionalProperties": {"type": "number"}},
          "suppressed": {"type": "object", "additionalProperties": {"type": "string"}}
        }
      }
    }
  }
}
