{
  "commodity": {
    "desc": "WHEAT",
    "slug": "wheat"
  },
  "schema_version": 3,
  "series": [
    {
      "canonical": true,
      "class": "ALL CLASSES",
      "period": "MARKETING YEAR",
      "suppressed": {},
      "unit": "$ / BU",
      "values": {
        "1949": 1.77,
        "1950": 1.96,
        "1951": 2.09,
        "1952": 2.14,
        "1953": 1.96,
        "1954": 2.02,
        "1955": 1.84,
        "1956": 1.86,
        "1957": 1.75,
        "1958": 1.79,
        "1959": 1.78,
        "1960": 1.71,
        "1961": 1.73,
        "1962": 1.98,
        "1963": 1.76,
        "1964": 1.31,
        "1965": 1.29,
        "1966": 1.58,
        "1967": 1.44,
        "1968": 1.14,
        "1969": 1.16,
        "1970": 1.27,
        "1971": 1.5,
        "1972": 1.35,
        "1973": 2.7,
        "1974": 3.62,
        "1975": 2.86,
        "1976": 3.1,
        "1977": 2.0,
        "1978": 2.95,
        "1979": 4.1,
        "1980": 4.2,
        "1981": 3.25,
        "1982": 3.0,
        "1983": 3.6,
        "1984": 3.4,
        "1985": 3.3,
        "1986": 2.8,
        "1987": 3.0,
        "1988": 3.5,
        "1989": 3.7,
        "1990": 3.07,
        "1991": 2.75,
        "1992": 3.35,
        "1993": 2.8,
        "1994": 3.3,
        "1995": 4.4,
        "1996": 4.36,
        "1997": 3.17,
        "1998": 2.39,
        "1999": 2.38,
        "2000": 2.54,
        "2001": 2.45,
        "2002": 2.7,
        "2003": 3.34,
        "2004": 3.37,
        "2005": 3.3,
        "2006": 3.52,
        "2007": 4.3,
        "2008": 5.36,
        "2009": 4.5,
        "2010": 4.7,
        "2011": 7.2,
        "2012": 6.85,
        "2013": 6.92,
        "2014": 5.75,
        "2015": 5.06,
        "2016": 4.47,
        "2017": 4.3,
        "2018": 4.88,
        "2019": 5.14,
        "2020": 5.42,
        "2021": 6.17,
        "2022": 8.45,
        "2023": 6.15,
        "2024": 5.5,
        "2025": 5.4
      }
    },
    {
      "class": "ALL CLASSES",
      "period": "MONTHLY",
      "suppressed": {},
      "unit": "$ / BU",
      "values": {
        "1949-01": 2.05,
        "1949-02": 2.0,
        "1949-03": 2.1,
        "1949-04": 2.05,
        "1949-05": 2.0,
        "1949-06": 1.75,
        "1949-07": 1.75,
        "1949-08": 1.75,
        "1949-09": 1.75,
        "1949-10": 1.9,
        "1949-11": 1.82,
        "1949-12": 1.79,
        "1950-01": 1.92,
        "1950-02": 1.92,
        "1950-03": 1.98,
        "1950-04": 2.0,
        "1950-05": 2.0,
        "1950-06": 1.9,
        "1950-07": 1.95,
        "1950-08": 2.0,
        "1950-09": 2.0,
        "1950-10": 2.0,
        "1950-11": 2.0,
        "1950-12": 2.1,
        "1951-01": 2.15,
        "1951-02": 2.2,
        "1951-03": 2.2,
        "1951-04": 2.2,
        "1951-05": 2.2,
        "1951-06": 2.15,
        "1951-07": 2.0,
        "1951-08": 2.0,
        "1951-09": 2.05,
        "1951-10": 2.15,
        "1951-11": 2.25,
        "1951-12": 2.25,
        "1952-01": 2.25,
        "1952-02": 2.25,
        "1952-03": 2.25,
        "1952-04": 2.25,
        "1952-05": 2.25,
        "1952-06": 2.2,
        "1952-07": 2.05,
        "1952-08": 2.05,
        "1952-09": 2.1,
        "1952-10": 2.1,
        "1952-11": 2.15,
        "1952-12": 2.15,
        "1953-01": 2.15,
        "1953-02": 2.15,
        "1953-03": 2.2,
        "1953-04": 2.2,
        "1953-05": 2.1,
        "1953-06": 1.8,
        "1953-07": 1.8,
        "1953-08": 1.8,
        "1953-09": 1.8,
        "1953-10": 1.85,
        "1953-11": 1.95,
        "1953-12": 2.0,
        "1954-01": 2.05,
        "1954-02": 2.05,
        "1954-03": 2.05,
        "1954-04": 2.0,
        "1954-05": 2.0,
        "1954-06": 1.9,
        "1954-07": 1.85,
        "1954-08": 1.85,
        "1954-09": 1.9,
        "1954-10": 1.95,
        "1954-11": 2.0,
        "1954-12": 2.0,
        "1955-01": 2.0,
        "1955-02": 2.0,
        "1955-03": 2.0,
        "1955-04": 1.95,
        "1955-05": 2.0,
        "1955-06": 1.85,
        "1955-07": 1.85,
        "1955-08": 1.75,
        "1955-09": 1.75,
        "1955-10": 1.85,
        "1955-11": 1.8,
        "1955-12": 1.8,
        "1956-01": 1.8,
        "1956-02": 1.8,
        "1956-03": 1.85,
        "1956-04": 1.85,
        "1956-05": 1.85,
        "1956-06": 1.85,
        "1956-07": 1.85,
        "1956-08": 1.9,
        "1956-09": 1.9,
        "1956-10": 1.95,
        "1956-11": 2.0,
        "1956-12": 2.1,
        "1957-01": 2.1,
        "1957-02": 2.05,
        "1957-03": 1.95,
        "1957-04": 1.95,
        "1957-05": 1.9,
        "1957-06": 1.7,
        "1957-07": 1.83,
        "1957-08": 1.8,
        "1957-09": 1.8,
        "1957-10": 1.83,
        "1957-11": 1.83,
        "1957-12": 1.85,
        "1958-01": 1.9,
        "1958-02": 1.96,
        "1958-03": 1.96,
        "1958-04": 1.86,
        "1958-05": 1.85,
        "1958-06": 1.83,
        "1958-07": 1.7,
        "1958-08": 1.7,
        "1958-09": 1.7,
        "1958-10": 1.7,
        "1958-11": 1.75,
        "1958-12": 1.75,
        "1959-01": 1.8,
        "1959-02": 1.85,
        "1959-03": 1.85,
        "1959-04": 1.85,
        "1959-05": 1.85,
        "1959-06": 1.79,
        "1959-07": 1.71,
        "1959-08": 1.75,
        "1959-09": 1.75,
        "1959-10": 1.75,
        "1959-11": 1.8,
        "1959-12": 1.8,
        "1960-01": 1.8,
        "1960-02": 1.8,
        "1960-03": 1.8,
        "1960-04": 1.8,
        "1960-05": 1.8,
        "1960-06": 1.7,
        "1960-07": 1.7,
        "1960-08": 1.7,
        "1960-09": 1.75,
        "1960-10": 1.75,
        "1960-11": 1.75,
        "1960-12": 1.75,
        "1961-01": 1.8,
        "1961-02": 1.8,
        "1961-03": 1.8,
        "1961-04": 1.8,
        "1961-05": 1.8,
        "1961-06": 1.72,
        "1961-07": 1.71,
        "1961-08": 1.74,
        "1961-09": 1.78,
        "1961-10": 1.78,
        "1961-11": 1.78,
        "1961-12": 1.78,
        "1962-01": 1.78,
        "1962-02": 1.78,
        "1962-03": 1.8,
        "1962-04": 1.8,
        "1962-05": 1.85,
        "1962-06": 1.98,
        "1962-07": 1.98,
        "1962-08": 1.95,
        "1962-09": 1.96,
        "1962-10": 1.96,
        "1962-11": 1.96,
        "1962-12": 1.96,
        "1963-01": 1.96,
        "1963-02": 1.96,
        "1963-03": 1.96,
        "1963-04": 1.96,
        "1963-05": 1.83,
        "1963-06": 1.75,
        "1963-07": 1.72,
        "1963-08": 1.73,
        "1963-09": 1.8,
        "1963-10": 1.97,
        "1963-11": 1.97,
        "1963-12": 1.97,
        "1964-01": 1.97,
        "1964-02": 1.95,
        "1964-03": 1.9,
        "1964-06": 1.3,
        "1964-07": 1.33,
        "1964-08": 1.34,
        "1964-09": 1.34,
        "1964-10": 1.38,
        "1964-11": 1.38,
        "1964-12": 1.39,
        "1965-01": 1.39,
        "1965-02": 1.44,
        "1965-03": 1.43,
        "1965-06": 1.28,
        "1965-07": 1.28,
        "1965-08": 1.34,
        "1965-09": 1.36,
        "1965-10": 1.35,
        "1965-11": 1.4,
        "1965-12": 1.43,
        "1966-01": 1.48,
        "1966-02": 1.47,
        "1966-06": 1.56,
        "1966-07": 1.65,
        "1966-08": 1.71,
        "1966-09": 1.76,
        "1966-10": 1.62,
        "1966-11": 1.69,
        "1966-12": 1.63,
        "1967-01": 1.62,
        "1967-02": 1.55,
        "1967-03": 1.6,
        "1967-06": 1.45,
        "1967-07": 1.35,
        "1967-08": 1.35,
        "1967-09": 1.35,
        "1967-10": 1.35,
        "1967-11": 1.3,
        "1967-12": 1.35,
        "1968-01": 1.35,
        "1968-02": 1.4,
        "1968-03": 1.4,
        "1968-06": 1.15,
        "1968-07": 1.15,
        "1968-08": 1.05,
        "1968-09": 1.0,
        "1968-10": 1.05,
        "1968-11": 1.1,
        "1968-12": 1.1,
        "1969-01": 1.15,
        "1969-02": 1.15,
        "1969-03": 1.15,
        "1969-04": 1.15,
        "1969-05": 1.15,
        "1969-06": 1.15,
        "1969-07": 1.15,
        "1969-08": 1.15,
        "1969-09": 1.15,
        "1969-10": 1.2,
        "1969-11": 1.25,
        "1969-12": 1.3,
        "1970-01": 1.25,
        "1970-02": 1.25,
        "1970-03": 1.25,
        "1970-05": 1.25,
        "1970-06": 1.25,
        "1970-07": 1.3,
        "1970-08": 1.3,
        "1970-09": 1.4,
        "1970-10": 1.45,
        "1970-11": 1.5,
        "1970-12": 1.5,
        "1971-01": 1.5,
        "1971-02": 1.5,
        "1971-03": 1.5,
        "1971-05": 1.4,
        "1971-06": 1.5,
        "1971-07": 1.5,
        "1971-08": 1.4,
        "1971-09": 1.45,
        "1971-10": 1.45,
        "1971-11": 1.5,
        "1971-12": 1.55,
        "1972-01": 1.55,
        "1972-02": 1.55,
        "1972-03": 1.47,
        "1972-04": 1.5,
        "1972-05": 1.4,
        "1972-06": 1.3,
        "1972-07": 1.3,
        "1972-08": 1.38,
        "1972-09": 1.6,
        "1972-10": 1.7,
        "1972-11": 1.8,
        "1973-01": 2.34,
        "1973-02": 2.15,
        "1973-03": 2.1,
        "1973-05": 2.25,
        "1973-06": 2.6,
        "1973-07": 2.56,
        "1973-08": 4.29,
        "1973-09": 4.48,
        "1973-10": 4.13,
        "1973-11": 4.05,
        "1974-01": 4.85,
        "1974-02": 5.35,
        "1974-03": 4.98,
        "1974-06": 3.42,
        "1974-07": 4.06,
        "1974-08": 4.14,
        "1974-09": 4.06,
        "1974-10": 4.58,
        "1974-11": 4.51,
        "1974-12": 4.15,
        "1975-01": 3.83,
        "1975-02": 3.57,
        "1975-03": 3.26,
        "1975-04": 3.14,
        "1975-05": 2.78,
        "1975-06": 2.62,
        "1975-07": 3.07,
        "1975-08": 3.48,
        "1975-09": 3.64,
        "1975-10": 3.58,
        "1975-11": 3.34,
        "1975-12": 3.23,
        "1976-01": 3.26,
        "1976-02": 3.41,
        "1976-03": 3.38,
        "1976-05": 3.16
      }
    },
    {
      "class": "WINTER",
      "period": "MARKETING YEAR",
      "suppressed": {},
      "unit": "$ / BU",
      "values": {
        "1949": 1.77,
        "1950": 1.96,
        "1951": 2.09,
        "1952": 2.14,
        "1953": 1.96,
        "1954": 2.02,